1473	0	a	Fallout 4's most powerful weapon has been discovered and it's not what you expected
1474	0	a	Guess which candidate's foundation was caught in an illegal campaign funding scheme?
1475	1	a	Tom Hiddleston opens up about Taylor Swift split, reveals if they're still friends
1476	1	a	Is Russia clamping down on Jehovah Witnesses?
1477	0	a	This country is the world's best place to retire and you probably wouldn't guess it:
1478	0	a	This new game is like Pokemon GO - but you can catch cash prizes instead
1479	1	a	Could BMI report cards from schools end childhood obesity?
1480	0	a	This is the safest place for you to sit in a plane
1481	0	a	Man discovers fawn 'hiding' in middle of the road - so he makes a fast decision
1482	1	a	Great news for Pearl Jam fans
1483	1	a	Did Pope Francis Just Pave the Way for Women Priests?
1484	2	a	How your doctor is turning into an airline
1485	1	a	There's a secret message buried inside Nintendo's new $60 console
1486	0	a	The Onion has a new owner, and it's no joke.
1487	0	a	The People's Favorite Pokemon Isn't Pikachu: Here's Who Took The Crown
1488	0	a	Lindsay Lohan is now dating a former pro athlete
1489	0	a	Painting Your Kitchen This Color Will Raise Your Home's Value
1490	0	a	You Won't Believe What Hillary Ordered the DNC to do to Bernie's Brother!
1491	1	a	How @LenaDunham really saw herself when she was young
1492	1	a	How millennials feel about unpaid internships revealed
1493	2	a	These are the 5 U.S. banks that draw the most customer complaints:
1494	1	a	Are we heading for another housing crisis?
1495	2	a	All the best deals on the internet this weekend
1496	0	a	Body in yard sale freezer freaks out N.C. woman. But then she recognized the foot.
1497	1	a	The truth about the uninsured rate in America
1498	0	a	The invention that stops girls from missing school every month
1499	0	a	'Stolen child'
1500	0	a	Amy Schumer gave her 'Hamilton' bartenders an extremely generous tip
1501	1	a	Colorado survey shows what marijuana legalization will do to your kids
1502	2	a	26 sex toys that actually get the job done
1503	2	a	It's Shocking How Much Money K-Pop Stars Actually Make
1504	1	a	Why Kat Dennings's Instagram Feed Is Breaking Our Hearts
1505	0	a	Why Waze may actually make some commutes a little longer:
1506	0	a	The "Most Likable Man in Hollywood" is ... (drum roll please)
1507	2	a	'Rick and Morty' season 3 spoilers, air date: Beth and Jerry to finally divorce? Evil Morty to capture Rick
1508	1	a	There May Be a Surprising Benefit to Sucking Your Thumb and Biting Your Nails as a Kid
1509	1	a	Here's what Microsoft co-founder Paul Allen actually found at the bottom of the ocean in the...
1510	0	a	Anthony Bourdain Says This Kitchen Staple Is a Waste of Money
1511	0	a	Rape Convictions Mandatory Minimum Bill Gains Opposition from Surprising Source
1512	0	a	One in six men find this woman more attractive than their wife
1513	1	a	There is life on Mars says scientists and it's closely related to our own planet
1514	0	a	Guess which 'flop' sold twice as well as the iPhone in its first year
1515	0	a	Warp speed won't get us to the stars, but this just might  via @NBCNewsMACH
1516	1	a	Can You Tell from a Child's Behavior If They'll Grow Up to Be a Prick?
1517	1	a	How 15 Minutes Could Change Your Sex Life
1518	1	a	It Doesn't Matter How Much You Exercise If You Also Do This
1519	0	a	And the Miss America 2014 crown went to...
1520	0	a	Mom delivers twins for the second time, then the nurses look down and see this
1521	1	a	Will Trump shut down pirate bay?
1522	1	a	One little drop of your blood may someday predict how long you'll live
1523	0	a	This is how much the average American wedding costs
1524	2	a	12 very obvious facts that will make you strangely happy
1525	2	a	How this entrepreneur is revolutionizing the 100-year-old automotive industry:
1526	0	a	Wearing a certain type of clothing will make women seem more intelligent
1527	0	a	Subway Manager Reveals The Sandwich You Should Never Order
1528	1	a	Do You Know Why We Take An Off On A Sunday, And Not Any Other Day?
1529	2	a	The FBI is on the Cusp of Obtaining Three Extremely Dangerous New Powers
1530	1	a	It's a Festivus miracle! Good news for "Seinfeld" fans
1531	1	a	Shameless Proposal? You Won't Believe the Offer Draymond Green's D*ck Pic Got Him
1532	2	a	People reveal their biggest regrets in life in heartbreaking admissions
1533	2	a	10 things you need to know before the opening bell
1534	0	a	AC Milan's Spending Spree Begins By Pursuing Arsenal Target
1535	1	a	This is why Brighton's indie food is better than London's
1536	2	a	This is what happened to the original "Sound of Music" cast
1537	2	a	This 113-Year-Old Soba Restaurant Closed for a Sad, Ironic Reason
1538	2	a	You won't believe how this college prof clickbaited students. Or what happened next.
1539	2	a	Former CEO of a $33 billion fast-food company explains why his best career advice for...
1540	2	a	What running a business has taught me about investing:
1541	2	a	How trainer Adonis Hill gained 70 pounds to help his client lose weight
1542	0	a	Here's how much money Jay Z's Barney collection racked in
1543	0	a	You won't believe what this Woman did to fulfill her desire to be a mother
1544	1	a	Bet you didn't know government jobs paid so well :p
1545	2	a	Britain's Got Talent Star Banned For This Death-Defying Act
1546	2	a	She Was The First To Ever Win Entertainer Of The Twice, What She's Doing Now...OMG
1547	1	a	Google Maps spots bikini-clad woman on a Costa Rican beach - can you see what's wrong?
1548	2	a	This candidate won first debate by a large margin, poll shows
1549	1	a	A cheap trick to keep your salon hair color from fading
1550	2	a	"Homeland" star apologizes for "fruity" remark about A-list actor
1551	2	a	"What Not To Wear" host makes major change
1552	1	a	Why Local Bands Never Become National Bands
1553	2	a	What Should Young Women Know Before Pursuing Tech Careers?
1554	0	a	Woah Guys Steady On - Snapchat Has Only Gone And Got A New Name
1555	1	a	Toxic air
1556	2	a	The workout classes celebrities swear by
1557	1	a	This Mom Tried To Surprise Her Daughter At College And It Went Hilariously Wrong
1558	0	a	"Sopranos" star won't watch James Gandolfini's final lead role
1559	0	a	PC/Xbox One Cross-platform play has officially arrived in this game
1560	0	a	This is the big lie about your olive oil
1561	0	a	BRB, crying! One of our favorite TV shows of all-time, was just canceled by Fox:
1562	0	a	Rapper donates $10000 to pay for a slain 6-year-old's funeral
1563	0	a	Study: People in this industry take longest lunch breaks
1564	1	a	Where does America's e-waste end up? GPS tracker tells all
1565	1	a	How British people can keep their EU passport
1566	1	a	The Story Of What Happened When Muhammad Ali Was Invited Upstairs By 3 Models
1567	0	a	Matt LeBlanc reveals the strangest place anyone has brought up Friends to him
1568	1	a	Millions of Americans Don't Want This Online!
1569	1	a	How to Remove Gel Nail Polish at Home (Without Totally Destroying Your Nails)
1570	1	a	The Hollywood "fallacy" Natalie Portman's tired of
1571	0	a	These Dogs Were Stranded During A Massive Flood... But Watch Who Comes To The Rescue!
1572	0	a	Here's How Many Black People Have Been Killed By Police Since Colin Kaepernick Began Protesting
1573	1	a	Get a head start on 4/20 with 'How to Smoke Pot (Properly)'
1574	1	a	The refrigerator of the future will do WHAT?
1575	2	a	5 Reasons Mooncop Will Be Your New Favorite Graphic Novel
1576	1	a	The Republican Party Just Gave Trump This DIRE Ultimatum
1577	0	a	Here's how to cheat at Pokemon Go and catch any Pokemon you want without leaving your home
1578	0	a	The Case of the Stanford Rapist Just Took Its Darkest Turn Yet
1579	0	a	This is outshining gold as a means of securing today's fortunes, BlackRock CEO says >
1580	1	a	The Dallas Cowboys are no longer America's Team, so who is?
1581	0	a	Find out which Filipina actress had a past romance with Vin Diesel!
1582	1	a	Is this America's most offensive burger?
1583	1	a	Terror from the sky
1584	2	a	How exactly did lightning kill 323 reindeer in Norway?
1585	2	a	Why UK surgeon cannot forget this girl
1586	2	a	I asked 5 fascism experts whether Donald Trump is a fascist. Here's what they said.
1587	0	a	Local Republican Party deletes racist slavery meme after no one laughs
1588	0	a	Man Rushes Girlfriend To The ER To Give Birth, But Doctors Tell Them There's No Babies
1589	0	a	When will Batman v Superman Ultimate Edition be available to rent on Amazon Video?
1590	1	a	Here's How You Can Get One of The 1 Million Xbox Live Gamertags Being Freed Up Today
1591	1	a	The truth about the so-called "Freshman 15"
1592	0	a	One big difference between the two "Thor" movies
1593	1	a	Once You Learn What Soft-Shell Crabs Are, It's Hard to Un-Know It
1594	1	a	Here's what happens to pro-athletes after they retire...
1595	1	a	Dad goes to incredible lengths to help son feel comfortable with a cancer scar (6 Photos)
1596	0	a	This prince bought plane tickets for his 80 falcons. Casual
1597	0	a	Why Turtles Evolved Shells: It Wasn't for Protection
1598	2	a	There's actually a scientific reason why you hate the word "moist"
1599	2	a	Good isn't good enough. Here's 6 things you need to stand out in the MBA applicant pool
1600	1	a	After Son's Death, Grieving Mother Texts His Phone And Gets A Heartwarming Response
1601	1	a	What the Media Gets Wrong About Women in Politics
1602	0	a	Anna Kendrick Reveals The Surprising Marvel Character That She Wants To Play
1603	1	a	Her Grandson Was Killed In Orlando. What These Passengers Did On Her Flight to His Funeral? TEARS!
1604	1	a	Why police were called to a South Jersey third-grade class party
1605	1	a	"We won every poll. Virtually every poll," Donald Trump said after the debate. But is that really true?
1606	2	a	She Announces There's A Fallen Soldier On The Flight. Then She Stands Up And Shocks EVERYONE
1607	1	a	Cat Finds An Orphaned Baby Rabbit. Even Mom's Shocked By What She Does With It
1608	2	a	Why Hollywood won't cast Jon Heder
1609	0	a	You won't believe what this woman found in her chicken
1610	1	a	If you eat garlic and honey on an empty stomach for 7 days, here's what happens to your body...
1611	0	a	A registered Republican in Texas was sentenced to eight years in prison for illegal voting:
1612	1	a	Apple Will Finally Fix the Thing You Hate Most About iPhones
1613	0	a	This is the most hated word in the English language, according to science
1614	2	a	When She Hears Her Favorite Song She Does Something Her Owner Just HAD To Film!
1615	0	a	The CEO of an Apple supplier just seemingly confirmed one of the biggest iPhone rumors
1616	1	a	@MileyCyrus is topless yet again -- this time on a horse and holding a blunt
1617	1	a	Why Facebook's attempt to tackle fake news is problematic:
1618	1	a	'All 50 States Could Be In Play' For Trump if he does this
1619	2	a	this guy has the fastest home internet in the united states
1620	0	a	She Removes The Bristles From A Toothbrush And It Turns Into THIS... INCREDIBLE!
1621	1	a	Here's why Donald Trump's kids can't vote in the New York primary
1622	0	a	The state with the most rich people AND highest poverty
1623	1	a	Twenty One Pilots Match A Charting Feat That Only The Beatles And Elvis Have Managed
1624	0	a	"Downton Abbey" star debuts drastically different look
1625	1	a	Brave new world.
1626	1	a	This Guy Keeps Getting Killed In Terrorist Attacks
1627	1	a	Are your Twitter followers actually bots?
1628	1	a	Snooki addresses plastic surgery rumors
1629	2	a	Are Sinister Clowns Trying to Lure Kids Into Woods Near This Apartment Complex?
1630	1	a	Why this presidential debate is Donald Trump's last stand
1631	1	a	Why the Stanford attacker's smiling photo is far more telling than any mugshot
1632	1	a	Did Benedict Cumberbatch Just Confirm That DOCTOR STRANGE Will Appear In THOR: RAGNAROK?
1633	0	a	You Won't Believe What Happened to This Patient After Having His Ears Pierced.
1634	0	a	This man created his own sex doll and it's as weird as you think
1635	0	a	How many licks does it take to get to the Tootsie Roll center of a Tootsie Pop
1636	1	a	Elon Musk had a hilarious response when his cousin asked for a Tesla discount
1637	1	a	Facebook is changing its News Feed again, and you'll never guess how!
1638	1	a	Could The X-Men Show Up In Avengers: Infinity War? The Director Weighs In
1639	1	a	How Two Idiots Accidentally Spent $1,100 On Sushi
1640	1	a	Here's the mistake Arya Stark made in the 'Game of Thrones' finale
1641	0	a	This poor guy's name was too dirty for Facebook
1642	2	a	You'll never guess what happened when three junkies tried to rob this former prizefighter
1643	0	a	Dinosaur erotica author reveals which dino is the best cuddler
1644	0	a	Kris Kristofferson's Doctors Thought He Suffered from Dementia. The Only Problem? He Didn't.
1645	0	a	This Common Prescription Drug Is Making People Uncontrollably Have Sex, Gamble, and Binge Eat
1646	0	a	The Secret Ingredient Chefs Won't Admit Using
1647	1	a	Minimalism no more! How I discovered the joy of recluttering
1648	0	a	The big mistake women are making at the gym
1649	1	a	Viral Video Gets 30,000 Republicans and Democrats to Vote Libertarian
1650	1	a	What Alex From Target Is Doing Now Is Unbelievable
1651	0	a	Photographs Of Cities From Space Have Shown A Worrying Trend
1652	0	a	Former Playboy playmate found dead in LA
1653	0	a	You Won't Believe What The Most Expensive Video Game Console Ever Is
1654	2	a	20 of the most forced rhymes in pop music history
1655	0	a	He's taller than every current NBA player. Oh, and he's only 16:
1656	0	a	Legendary editor dies
1657	1	a	The LinkedIn Mistake That's Hurting Your Career
1658	0	a	Only 1 state's college students graduate with less than $20K in debt
1659	1	a	Why do dozens of GOP super PACs have the same official address?
1660	1	a	This Is The Reason Why GTA V Hasn't Had a Single Player DLC Yet
1661	1	a	Before You Spend $26,000 on Weight-Loss Surgery, Do This
1662	0	a	The single most stolen item in any public library  (Hint: It's a bit lascivious)
1663	1	a	It Bitcoin Still a thing?
1664	0	a	This state may legalize pot very soon
1665	0	a	Meet "The Simpsons" latest star
1666	1	a	The mystery behind China's giant pyramid hills
1667	2	a	The five worst atrocities carried out by the British Empire will make you wonder why we're apparently proud of it
1668	1	a	What Connie Britton would be doing if she wasn't an actress
1669	0	a	Trailer Musician Apparently Knows Death Stranding's Release Date
1670	2	a	This Restaurant In NYC Serves A $1,000 Dessert... And You Won't Believe What's In It
1671	1	a	There's something VERY wrong about this picture....can you spot it?
1672	2	a	.@POTUS answered an important New Yorker question: what's his favorite kind of bagel?
1673	0	a	Researchers have found the worlds ugliest colour
1674	0	a	This state smokes twice as much pot than previously thought
1675	1	a	The F-35 just proved it can take Russian or Chinese airspace without firing a shot
1676	1	a	Hungry hungry sea monster found with surprise in its belly
1677	0	a	PS4's Gran Turismo Sport Lacks These Two Major Features of Past Games
1678	1	a	"Where was your sense of decency?"
1679	0	a	You'll never guess what this man had living in his EAR
1680	1	a	This Behavior Is The #1 Predictor Of Divorce, And You're Guilty Of It
1681	0	a	Why Medical Experts Advise People Over 40 to Stop Taking Ibuprofen Immediately!?
1682	2	a	His Babysitter Was A Monster And Mom Had No Idea. Then the Dog Started Acting Strangely...
1683	0	a	HBO Has Officially Confirmed Who Jon Snow's Father Is
1684	0	a	How did we never notice Britney Spears wearing this ~one thing~ throughout 1999?
1685	0	a	You Won't Believe What Taylor Swift Has Designed
1686	2	a	Nightclub responds brilliantly to a woman's racist rant
1687	0	a	The Diet That Kills Memory And Cognitive Skills
1688	1	a	Fact or fiction: Pulling out a gray hair will cause two more to grow in its place. The answer:
1689	1	a	(VIDEO) You'll Never Guess How This Cute French Bulldog Responds When He Encounters a Statue...
1690	1	a	Doctor Didn't Believe Her Until He Discovered THIS
1691	2	a	It's the kind of pizza recipe you'll return to again and again
1692	0	a	You Won't Believe How Many Eyeliners Kim Kardashian Uses to Get a Natural Makeup Look
1693	0	a	Shocking video alledgedly shows shots being fired at Greenpeace activists
1694	0	a	Lena Dunham Shares Shocking Pregnancy Test Results
1695	0	a	You Won't Believe How Many Copies Grand Theft Auto V Has Shipped Since Release
1696	0	a	There's a sexy (and sweaty) new home trend that you have to try
1697	1	a	You've Been Doing High-Fives Wrong All This While. Here's How It's Really Done
1698	0	a	How much sex should you be having?
1699	1	a	Will the skyscrapers outlast the pyramids?
1700	1	a	The Real Reason Why Some People Cry More Easily Than Others
1701	0	a	"Family Ties" star ties the knot with longtime girlfriend
1702	0	a	This is officially the best pub in the UK
1703	2	a	You won't believe which brand posted this offensive Tweet
1704	1	a	Man Tells Cop There's A Loaded Handgun In His Glove Compartment. Cop's Reaction? Stunning
1705	1	a	WTF is clickbait?
1706	0	a	"American Horror Story" star joins "Hunger Games"
1707	0	a	If history is any guide, the ideal day to announce for president is...
1708	1	a	"Jason Sudeikis' Son Had An Adorable Reaction To The Angry Birds Movie"
1709	2	a	The 11 skills every 24-year-old should learn
1710	2	a	Have you stopped wearing razor back and off shoulder tops because of your #sagging arms? This one's for you
1711	2	a	Why this lady rocker isn't finished with motherhood
1712	1	a	The secret to 93-year-old Betty White's eternal youth
1713	1	a	Here's how you can change your Pokemon Go team
1714	0	a	EVERY Anti-vaxxer Needs to See: Mom Urges Other Parents to Vaccinate Their Kids After Her Baby Was Hospitalized With a Horrific Disease
1715	1	a	The one thing Margaery (aka, Natalie Dormer) is NOT going to miss on "Game of Thrones"
1716	0	a	THIS auto stock is tipped to double in 2016
1717	0	a	You won't believe how long this man has been a member at the same golf club
1718	0	a	How many billionaires own sports teams?
1719	1	a	10 killed when a prison bus crashed into a train
1720	2	a	When She Called To Thank A Man For His Help, She Learned Something Devastating
1721	1	a	How a design for city living went wrong | Letters
1722	1	a	There's a story behind the video of a man punching a kangaroo the head
1723	2	a	Why Doing Nothing Is So Scary-and So Important
1724	1	a	How is Donald Trump going to quit?
1725	0	a	The name of this new Rogue One character does not sound cool
1726	1	a	Is the Sun DISINTEGRATING? NASA spots monster hole open up on our star
1727	1	a	Why Your Cat Is So In Love With Boxes
1728	1	a	The Internet Is Warring over a Photo of Garlic Bread. You Will Not Guess Why.
1729	2	a	These are the fastest ways to make friends, according to one scientist
1730	1	a	Why you should not watch this video
1731	1	a	Did Hillary Clinton Use a Body Double After Falling Ill at 9/11 Memorial Appearance?
1732	1	a	Here's how you can get paid $16,000 to lie in bed all day
1733	2	a	10 Movies That Got 100% On Rotten Tomatoes (And A Few That Got Close
1734	1	a	This Bride Had the Most Amazing Reaction When Her Groom Called Off the Wedding
1735	0	a	The scary thing your sleepless nights could cause
1736	2	a	5 things to know about FFC-Acrush, China's hottest "boy band" made up of All girls
1737	1	a	Husband Divorces Wife For Most 21st Century Reason Ever
1738	1	a	You'll never guess what's hiding beneath a West Antarctica ice sheet
1739	0	a	Here's When Xbox One Play Anywhere Feature Is Going Live
1740	0	a	This is the Age Most People Stop Smoking Weed
1741	0	a	This Is The Most ''Feel-Good'' Song Ever, According To Science
1742	2	a	8 guaranteed ways to double your salary in 2 years
1743	0	a	Madonna reveals the one "gay" man she wants to turn straight
1744	0	a	Google Maps Just Got A Big Update -- Can You Spot The Difference?
1745	2	a	Why you'll NEVER get a flat stomach eating these surprising foods
1746	2	a	STOCKS DO NOTHING: Here's what you need to know
1747	1	a	Democrats have a secret plan to win red states without moving to the center
1748	0	a	Millennials are going against this major engagement and wedding tradition
1749	0	a	Tiny town nestled INSIDE a crater
1750	1	a	Dunkin' Donuts and Starbucks might be spending millions of dollars for nothing
1751	0	a	Zooey Deschanel has revealed the name of her baby girl
1752	1	a	The Reason There's A Hole In Your Spaghetti Spoon Is ACTUALLY Genius
1753	1	a	If you eat 3 whole eggs every day, you'll be surprised what it does to your body
1754	0	a	Guy Keeps Getting Accidentally Tagged In Porn On Twitter Because Of His Name
1755	0	a	Teen With Rare Brain Disease Speaks For The First Time After 4 Years Of Silence. LISTEN To What She Has To Say...
1756	1	a	Pokemon Go Players Have Already Found A Major Issue With The Game
1757	1	a	The babygrow that's making dads angry
1758	1	a	Margot Robbie Refused To Lose Weight For Tarzan For A Brilliant Reason
1759	0	a	And the U.S. city with the worst traffic is...
1760	0	a	What do Bruce Willis Bryan Cranston and Voldemort have in common?
1761	1	a	Here's why dozens of celebrities are making the 'W' sign
1762	2	a	Former "Curb" star lands new role on Robin Williams' sitcom
1763	0	a	Attempt to determine best ninja turtle using video games
1764	1	a	Pokemon Go Has A Feature That Nobody Knows How To Use
1765	2	a	Actress confirms "Star Wars" rumor
1766	1	a	Rowan Atkinson Dead: Mr. Bean Actor Found 'Unconscious &amp; Not Breathing'
1767	2	a	Does Your Opinion On Porn Shift With Your Relationship Status?
1768	1	a	Kobe Bryant perfectly explains why Lakers don't need to retire both 8 and 24
1769	2	a	Here's when "Hamilton" tickets go on sale in Chicago, and the eye-popping price range
1770	2	a	Will Republicans ditch Trump at the convention?
1771	0	a	Meet your new Christian Grey
1772	0	a	The New Zelda Game Is Going to Let You Do Something Totally New
1773	2	a	 Win 2 tickets to Hot 97's Hot For the Holidays show Here's how to score your seats --&gt;
1774	1	a	Today is the Day the UN Celebrates Women and Girls in Science. Here's Why That's So Important |...
1775	0	a	Katie Ledecky could shatter an unbreakable barrier at the Olympics
1776	1	a	This is why India has highest number of #selfie deaths in the world
1777	0	a	The biggest loser in the Comcast-TWC merger collapse is not who you think:
1778	0	a	Starbucks Will Start Offering This Popular Non-Dairy Option Next Month
1779	2	a	He hears a whale crying and follows the sound. Now WATCH what happens when he get closer...
1780	2	a	This Tea Party Congressman Responded To The Dallas Shootings In The Worst Way Possible
1781	1	a	'Pokemon Go': How to Find and Catch Legendaries
1782	0	a	The senator who held the most floor time in 2013 was...
1783	2	a	You definitely didn't learn about these 'American Gods' in Sunday school
1784	0	a	The model who changed everything
1785	1	a	GREAT news for pit bull lovers
1786	0	a	Older dads may have kids with a greater risk for THIS:
1787	0	a	Veteran journalist joins State Department
1788	1	a	This Popular Great Depression Recipe Would Be Inedible By Today's Standards
1789	2	a	31 annoying words and phrases on your resume that make hiring managers cringe
1790	1	a	Girl had a perfect response when asked why she wanted a black doll
1791	2	a	Meet the world's hottest flight attendants
1792	2	a	This electric car startup is missing just one thing
1793	1	a	GOP congressman: Sochi Olympics could become "nightmare like Benghazi"
1794	0	a	"Motown: The Musical" star opens up about cancer battle
1795	0	a	We weren't expecting those Carey Mulligan
1796	2	a	This Teen Got a Mysterious Illness From Something Millions Wear Every Day
1797	0	a	If your tongue is this color you've got a problem
1798	1	a	Has Marc Jacobs been fired?
1799	1	a	Mom Dies During Labor, But Then The Doctors See Something Strange - INCREDIBLE!
1800	1	a	White Privilege: Stanford Rapist's Jail Sentence Cut Short For The Most F***** Up Reason
1801	1	a	What It's Like To Go To Weed Yoga
1802	0	a	There is only one way to deal with Donald Sterling
1803	1	a	Is 'Fargo' season three headed to St. Cloud?
1804	0	a	WHO invented binary math?
1805	2	a	One "Law And Order" character revisits her splashy departure from the show
1806	1	a	Will Israel be put on trial for war crimes?
1807	1	a	Do you work at night? Here's why you shouldn't drive home afterward
1808	1	a	Relax: U.S. runner Ashton Eaton had a good reason for wearing that Canada hat
1809	1	a	Check out what happened almost 10 years after she went missing!
1810	0	a	You won't believe where the next 'Battlefield' game is going
1811	1	a	Right after the birth.
1812	2	a	19 lies you actually believed as a teen
1813	0	a	Party drug could help treat depression
1814	0	a	The one kind of makeup you'll need in 2014
1815	0	a	@selenagomez skips pants for a night out in London
1816	1	a	Can You Really Be Poisoned By Green Or Sprouting Potatoes?
1817	1	a	Fifth-grader asks police for help with math homework, and this was their response
1818	1	a	Why is the U.S. investigating FIFA?
1819	1	a	How David Brat Won
1820	1	a	Look What Happens When You Drink Nothing But Water For 30 Days...
1821	0	a	Rock legend crashes stunned couple's wedding and gives them a performance to remember (VIDEO)
1822	1	a	Here's how long it takes to reach the centre of No Man's Sky
1823	2	a	8 life-changing things to try in December
1824	0	a	Michigan Gave Drug Tests to Welfare Recipients. Take a Guess at How many Failed.
1825	1	a	This is what happens if you cheat at Pokemon Go
1826	1	a	Emma Watson snags majorly flattering title
1827	1	a	The 'one thing you never noticed about Monica's apartment' is either proof of the multiverse or...
1828	0	a	Surprise #sagawards nominee is happy with the recognition
1829	1	a	Mother 'broke down' when she discovered why her daughter was standing on toilet
1830	0	a	Here's What Happens When You Throw an iPhone Off the World's Tallest Building
1831	0	a	What a name.
