740	1	a	Facebook Learns People Hate Clickbait; You Won't Believe What Happened Next
741	2	a	Black supermodel lands major beauty deal
742	0	a	Toronto mayor says he has no reason to quit
743	0	a	Buckle up! The worst state for drivers is...  via @YahooFinance
744	1	a	This Florida home has one very bizarre feature
745	2	a	The darkest colour in the world is effectively exclusively owned by this artist - here's why
746	0	a	This person is living their dream life-and you can follow it on Instagram
747	1	a	The Queen Refused To Sit On The Iron Throne For The Most Obscure Reason
748	1	a	How to Stream Tonight's First Presidential Debate Online, No Cable Required
749	0	a	Revealed: the sexiest profession of the 21st Century
750	2	a	Missed the most important stories from yesterday?Read on!
751	1	a	Jay Z says goodbye to major accomplishment
752	1	a	Woo-hoo, bank error in your favor! But, can you keep the cash?
753	1	a	LeBron James had a great response when the top pick in the NBA Draft said he couldn't wait to face him
754	0	a	This employee benefit could become as popular as the 401(k)
755	2	a	15 Crazy World of Warcraft Facts That Will Impress Your Guildies
756	1	a	This is why you should never, ever leave your phone at work
757	1	a	The REAL reason "Mythbusters" was canceled
758	1	a	Groupon couldn't handle how insanely popular this deal was
759	2	a	Something weird happens to your brain when you start improvising
760	0	a	Why Agents of S.H.I.E.L.D. chose Robbie Reyes' version of Ghost Rider
761	1	a	Bethesda shares some bad news about Fallout 4 PS4 Mod support
762	0	a	The one thing that will help you make better decisions
763	1	a	How @aaronpaul_8 is leaving Jesse Pinkman behind
764	0	a	Iconic broadcaster Chick Hearn basically predicted how long Kobe would play for the @Lakers:
765	1	a	Abercrombie &amp; Fitch is facing a terrifying reality about its most loyal customers
766	1	a	Facebook's "Stories" feature means no more stealthy profile creeping.
767	0	a	Model @MirandaKerr lands a sweet new job
768	2	a	23 reasons why the Great British Bake Off is the best show on Netflix
769	1	a	Why Margot Robbie Doesn't Like Harley Quinn's Outfits In Suicide Squad
770	1	a	Magician makes dozens of people smile with a simple trick
771	1	a	Male Escort Reveals What Women Really Want In The Bedroom
772	1	a	This husband's viral post urges men to respect their wives as mothers
773	2	a	What the plagiarism controversy tells us about Trump's campaign
774	1	a	Bad job interview? Ask for a do-over
775	1	a	A boy was enjoying video game shopping - little did he know what would happen next
776	1	a	The truth behind THAT #Oscars2017 gaffe
777	0	a	What Charles And Ray Eames Might Have Done With Modern Materials
778	2	a	The best type of man to date
779	0	a	Another Oscar winner is making the move to TV
780	2	a	Russian activist woke up to a shocking present left on her car
781	0	a	Survey reveals which European country cheats most
782	2	a	The best movies you missed in 2014:
783	1	a	Nightmare scenario
784	0	a	Marvel Assembles an Official Title for Third "Avengers" Movie
785	0	a	Anthony Bourdain Reveals His Favorite City for Solo Travel
786	1	a	How Israel forces more Palestinians out of Jerusalem
787	2	a	13 incredible science facts you probably didn't learn at high school
788	2	a	Here are the 10 countries where homosexuality may be punished by death
789	1	a	This is what happens when you have $100,000 to shoot a music video but the star never shows up
790	1	a	Donald Trump praised Vladimir Putin on the national stage again - here's what it all means
791	0	a	This is one of the biggest skills new graduates lack
792	1	a	The REAL story behind "Dude (Looks Like a Lady)"
793	2	a	This terrifying disease is making a comeback in Syria. Here's how we can stop it
794	1	a	Wondering why that millennial won't take your phone call? Here's why ...
795	0	a	Surprise, surprise - Jimmy Fallon can't hold in his laughs when he finds out what part of Miley looks like Seth Rogen
796	2	a	These are the worst airports in America
797	2	a	You Truly Are 100% Emo If You Can Finish These Lyrics
798	0	a	Canada's unnamed
799	0	a	Drunk Girls On Spring Break Answer The One Question You've All Been Wondering
800	2	a	"Fifty Shades of Grey" star makes hilarious confession
801	2	a	This is why Trump's suits fit so badly
802	1	a	Man makes impressively bizarre hotel request, hotel kindly delivers
803	1	a	Does Tebow Really Want to Be A Miner League Baseball Player?
804	0	a	Penelope Cruz talks sharing a bed with beautiful actress best friend
805	2	a	8 Ways To Reduce Side Fat, And They're All Super Easy
806	1	a	The Arabic text on these bags makes a hilarious but depressing point
807	2	a	This Is How You Can Make Your Clogged Pores Disappear Using ONE Cupboard Ingredient
808	0	a	New burger chains are cutting out a key ingredient:
809	1	a	Can Cannabis Help Senior Citizens Survive?
810	1	a	Learn how to brush your teeth mindfully, and you can also be brushing your brain
811	1	a	Would you pay $10 mil for this painting?
812	0	a	Here's why your goodbod became a dadbod (and how to reverse it)
813	0	a	This McDonald's Is About to Start Serving All-You-Can-Eat French Fries
814	0	a	You won't believe (or be able to pronounce) Lorde's real name
815	1	a	Scientists have a new theory for why we haven't found alien life
816	1	a	This dude's face sums up how Americans feel about the Trumps and Black History Month
817	0	a	Gay NFL Veteran: "I did not feel safe at all" in the locker room
818	1	a	This Hyena Was Cornered By A Pack Of Wild Dogs, But What It Does Next...
819	0	a	Daniel Radcliffe Has Confessed The Harry Potter Actors He Was Secretly Terrified Of
820	0	a	China Confirms Its Space Station Is Falling Back to Earth
821	1	a	Apple's New App: Can Deep Breathing Lower Stress?
822	0	a	Is this New York's new Rain Room?
823	0	a	Evanna Lynch (aka Luna Lovegood) just discovered her patronus and she is NOT amused
824	1	a	Furious Mum Finds 'Drugs' In Daughter's Room, She Gets Off The Hook In An Amazing Way
825	1	a	Here are all the atheists in Congress
826	0	a	The Grand Tour launch date
827	1	a	There's a Surprising Link Between Alcohol and Cancer
828	1	a	Apple's reaction to the Galaxy note 7 was brilliant, and we all missed it
829	0	a	Don't Be Surprised When Seeing Men With A Painted Fingernail, Here's The Meaningful Message Behind This Trend
830	0	a	Don't Throw Away the Lids to Your Pots and Pans Just Because They're Missing Handles. Do This Instead.
831	0	a	Here's Why People Unfriend You On Facebook, According To Science
832	1	a	This One Small Detail You Totally Missed From "The Little Mermaid" Is Absolutely Crazy!
833	0	a	Jeb Bush leads Hillary Clinton in critical swing state:
834	2	a	28 things every person absolutely hates that they do but does anyway
835	2	a	27 things you didn't know your iPhone could do
836	0	a	This airline is saying goodbye to reclining seats
837	0	a	GUESS HOW MUCH GOOGLE PAID THE GUY WHO BRIEFLY OWNED GOOGLE.COM
838	0	a	Days After "The Voice" Star's Murder, Adam And Blake Post Shocking New
839	1	a	Sounds like a winning argument to me!
840	0	a	Celebs You Didn't Know Passed Away: #17 is Shocking
841	2	a	13 weird Christmas traditions from around the world that'll surprise you
842	1	a	Why Viola Davis Wanted To Pepper Spray Jared Leto
843	1	a	Obese Social Worker Reveals How He Got Ripped To Shit In 12 Weeks
844	0	a	Guess How Much That Anti-LGBTQ Law Is Costing North Carolina
845	1	a	Cybill Shepherd's new TV role is kind of perfect we think
846	2	a	Real parents reveal 16 things totally worth spending money on
847	0	a	Kylie Jenner's Snapchat is extremely dangerous for one main reason
848	1	a	This is why Niantic has blocked third-party Pokemon Go trackers
849	1	a	Home-cooked meals and Netflix on Mars? It's possible
850	0	a	Which City Is the Worst for Spring Allergies?
851	0	a	Emma Watson found this one small flaw in playing Hermione...
852	1	a	Is a Khal Drogo-Khaleesi Reunion Actually Going to Happen on 'Game of Thrones'?
853	2	a	Is Taylor Swift really a mean girl?
854	0	a	He was murdered 34 years ago - and his Twitter account won't let you forget it
855	0	a	'West Wing' cast reunites, reveals who President Bartlet would endorse in 2016
856	1	a	Jamie Dimon: This is the 'biggest disgrace' in America
857	1	a	Can you put out a pool on-fire with liquid nitrogen?
858	1	a	Something's Gone Wrong At Starbucks, According to Baristas
859	1	a	Archaeologists Just Discovered Something Extraordinary Underneath The Scene Of A Nazi Massacre
860	1	a	They Released 14 Wolves Into A Park. What Happens Next Is A Miracle And Proves That We Must Take Care Of Our Amazing Planet
861	2	a	Do these 6 things in the morning to be productive all day:
862	1	a	Cats, Dogs, and Other Animals Can See Beyond Human Perception
863	2	a	24 songs that you literally have to sing at the top of your lungs
864	1	a	Why the Curiosity Rover is Forbidden From Collecting Water on Mars
865	1	a	Zac Efron and Brittany Snow cozy up during Haunted Hayride
866	1	a	The Dominant Life Form in the Cosmos Is Probably Superintelligent Robots
867	0	a	Big name actress begins stumping for Hillary Clinton
868	0	a	Retired NFL star destroys argument against gay players
869	2	a	Best Apple deals: iPad Pro and iPhone 6s hits new lows
870	1	a	Miley Cyrus just revealed this shocking truth bomb about her time on "Hannah Montana"
871	2	a	This waitress got the tip of a lifetime
872	1	a	Here's What Synthetic Cannabis Is Really Doing to Your Brain
873	1	a	Ali Larter (@TheRealAliL) is doing WHAT now?
874	1	a	Jay Z's new project is totally unexpected
875	1	a	I Tried a Hair Straightening Brush and This Is What Happened
876	0	a	Do You Know Who Is The Reason Behind Katrina Kaif's Debut On Facebook?
877	0	a	New Yorkers Just Received a Terrible Emergency Alert
878	2	a	"Potentially, this is worse than anything he did in Watergate"
879	1	a	Future back on tour with Drake?
880	0	a	The top earning female in hip-hop is ... "
881	2	a	I asked 5 fascism experts whether Donald Trump is a fascist. Here's what they said.
882	2	a	Here's What Scientists Found When They Opened A Cave That Had Been Isolated For More Than Five Million Years
883	0	a	How old would Fred Savage's character from "The Wonder Years" be today?
884	0	a	Don't forget the most important part of your Super Bowl party (hint: it's not beer or wings)
885	0	a	This One Trick Will Make Your Guacamole So Much Better
886	1	a	How to watch the Oscars this year
887	1	a	Why Charlie Hunnam dropped "50 Shades of Grey"
888	1	a	You Won't Believe What Killed Off The Wooly Mammoth
889	0	a	'Sausage Party' Post-Credits Scene: Did Seth Rogen Hide A Scene After The Credits In The R-Rated Animated Comedy?
890	0	a	This Viral Photo Reveals A Breast Cancer Symptom You Might Not Know
891	0	a	Forest Whitaker's is playing a fan favorite character in 'Star Wars: Rogue One'
892	0	a	She Tells Daddy To Watch The Ceiling. When He Looks Up? I Can't Stop SMILING!
893	0	a	Here's How To Avoid One Of The Most Common Life Regrets
894	0	a	State moves one step closer to ending medical marijuana "chaos"
895	2	a	21 little things that ruin every retail worker's day
896	0	a	Brother Agrees To Babysit His Sister's Boyfriend's Kid, Later Discovers Sister Left Out One Tiny Detail
897	1	a	Dad Puts Boiled Crayons Through A Pasta Strainer. Wait Until You See What He Does With Them!!
898	0	a	This is the most hated team in Pokemon Go
899	0	a	Taylor Swift's Started Dating Marvel's Greatest Super Villain
900	1	a	One major downside to IUD use
901	1	a	Follow my lead
902	2	a	The Little Boy In Aleppo: Can One Photo End A War?
903	2	a	The devastating way this star learned her show was ending
904	0	a	That time a world famous actor was mistaken for a beggar
905	2	a	America's Hogwarts Houses' Names Revealed - Fan Fest
906	0	a	You'll Never Believe Which Beauty Product Makes Women Feel the Most Confident
907	1	a	What Marco Rubio would need to do to win
908	0	a	You know it as a Super Food, the new Party Drug That Will Give You a Sweet High
909	2	a	This is how much time a gamer took to walk across Far Harbor Map compared to Shivering Isles
910	2	a	Grandma Dies With A Hidden Secret. Then Mom And Dad See THIS In The Delivery Room...
911	1	a	This Is Going to Be the Biggest Halloween Costume of 2016
912	2	a	15 great excuses to not go out tonight
913	1	a	The Secrets of Medieval Castles: Stairs are built in a clockwise fashion for a VERY good reason
914	0	a	[St. Louis] Cardinals player killed in car accident
915	1	a	You Won't Believe What Maids Do With Soap Bars
916	0	a	You'll Never Be Able To Unlearn What Figs Are
917	0	a	You'll Never Guess What's Forcing Khloe Kardashian's Lamar Odom Divorce - For The Best In...
918	1	a	EVERYONE could get 330 from MasterCard - here's how
919	1	a	How doctors were wrong to call me a too-busy mum
920	1	a	This was one of the worst things going on in private prisons
921	1	a	Revealed: the truth about penis size.
922	1	a	What @taylorswift13 has in common with the shortest living man
923	1	a	The type of facial hair women find most attractive on men.
924	1	a	So THAT'S why there's a little diamond patch on some backpacks
925	2	a	Revealed: The unexpected and unwanted ingredients in your food
926	0	a	Queen Elizabeth is hiring a live-in housekeeper - and the salary is shocking
927	0	a	Antonio Conte reveals how Eden Hazard has got back to his best
928	0	a	The premiere date for #Sherlock season 4 has FINALLY been revealed (!!!):
929	1	a	Is Taylor Swift The Clone Of A Former Satanic Leader? This Is Bizarre!
930	1	a	That's the running joke among #Indian #entrepreneurs
931	2	a	Student who faced rape &amp; death threats said university told her to just wear a hat &amp; lay low
932	1	a	You Would Not Believe What This Man Complains to Ikea About Its Shower Stool
933	2	a	Bisexual "True Blood" star makes awesome Pride declaration
934	1	a	Social Security's looming $32 trillion shortfall
935	2	a	The real reason Meg Ryan's career was ruined
936	0	a	The perfect sweet component to spicy chicken wings
937	2	a	She Has No Idea Why Her Toddler's Legs Are So Red. Then She Finds The Cereal Box In The Pantry
938	1	a	I Ate Baby Food for An Entire Week And This Is What Happened
939	1	a	Trump Is Paying Himself With Campaign Cash. Is That Legal?
940	2	a	5 Things to Watch at Monday Night's Clinton-Trump Debate
941	1	a	How Jason Momoa Got His Scar on His Eyebrow
942	0	a	How to Get Legendary Pokemon in Pokemon Go
943	0	a	You'll Never Guess What Facebook Is Cracking Down On Now
944	2	a	What this top-tier designer wishes she knew at 25
945	1	a	Mark Hamill May Have Given Away a Huge Spoiler About Star Wars: Episode VIII
946	2	a	A Couple Took In This Gorgeous Baby Girl. Then They Found Out What Her Mom Had Done to Her
947	0	a	University tries to regain trust of students in sexual assault cases
948	0	a	Obama picks a new top energy and environment adviser
949	0	a	Michael Bloomberg's next job
950	1	a	Here's Why This Woman Left Another Woman Naked And Beaten In The Street
951	1	a	Here's Why Lawyers Suggest You Stop Using Your Finger to Unlock Your Phone
952	1	a	Secret trick allows you to have unlimited Pokeballs in Pokemon Go
953	0	a	Only Beyonce could pull off something like this
954	0	a	Doctors were startled to find the cause of this 24-year-old's excruciating pain
955	0	a	@LadyGaga slams the magazine that put her on the cover
956	1	a	Taking photos with an iPad or another tablet: Ridiculous or smart?
957	0	a	Amazon is bringing 2,000 jobs to this Rust Belt town
958	0	a	Scientists Uncover Mystery Of Singing Fish
959	0	a	Battlefield 1 producer has teased a brutal new feature for the game
960	2	a	These beer gardens are the best places to finally welcome spring
961	1	a	Is the Orlando Pulse Shooting Related To Christina Grimmie's Shooting?
962	0	a	Are earthquakes around Yellowstone getting out of control?
963	0	a	Neil deGrasse Tyson names the genius who blows *his* mind.
964	0	a	"X-Files" star Gillian Anderson opens up about her relationship status
965	1	a	Little boy lost his stuffed elephant - you won't believe what happened next!
966	0	a	Jane Lynch's (@janemarielynch) ex makes BIG request
967	2	a	Try the following tricks to see if they get the hint (:
968	1	a	Did Jason Momoa Just Drop A Massive Hint About GOT Season 7?
969	2	a	CNBC host makes wildly offensive comments
970	1	a	Is This Most Expensive Easter Egg in Movie History?
971	0	a	There's a Reason Khloe Kardashian Avoids Bikinis at All Costs
972	2	a	Hiring managers are almost always looking for these 5 traits:
973	1	a	Bad news for The Division cheaters as Ubisoft finally announce harsh punishment for offenders
974	1	a	This Year's Perseid Meteor Shower Is Going To Be Quite A Show - Here's How To Watch
975	1	a	Mom Puts Her Baby Girl On The Carpet. Now Watch How The Cat Reacts
976	2	a	This school board's new proposed dress code leaves many students wondering what they can wear to school!?
977	0	a	Enormous "Frog Penis" That Went Viral Isn't A Penis At All
978	2	a	You Won't Believe the Reason This Nanny Beheaded a Toddler
979	0	a	This Ingredient Of Many Consumer Products Can Damage Your Health
980	0	a	Zlatan Has Most Zlatan Reason Ever For Changing Hotel
981	0	a	The one item that looks amazing on every woman
982	2	a	Who are the European Golden Boy winners since 2003 - and what happened to them?
983	0	a	New "X-Factor" judge promises tough love for contestants
984	0	a	The world's fastest woman
985	0	a	This state just banned increasing the minimum wage
986	2	a	You'll never believe what Medicare won't pay for
987	0	a	You won't beleive who Columbus short-reportedly marrie
988	2	a	Remember This Book? The Author Just Confessed What It's Really About-& It'll Rip Your Heart Out
989	0	a	They don't call him The Truth for nothing.
990	1	a	This Mother Did Nothing When Her Daughter Insulted An Autistic Boy, But Never Expected THIS
991	2	a	Why this county refused to lower flags after Orlando
992	0	a	This pro athlete admits he loses sleep over the game
993	0	a	Utah Has A Condiment We'd Never Heard Of
994	0	a	One Quality In Men Might Be Even More Attractive Than Good Looks And A Sense Of Humor
995	0	a	Where the "Masters of Sex" creator has met everyone she's ever been with romantically
996	1	a	Michelle Obama Claims the White House Was 'Built by Slaves'... But There's One HUGE Problem
997	0	a	Hillary Gets a Reality Check With the Real Word to Describe What She Calls a 'Security Inquiry'
998	0	a	Google Pixel/Nexus 2016 Release Date
999	0	a	Long-Term Marijuana Use Has One Crazy Side Effect, New Study Says
1000	0	a	Why you probably want to stay far far away from M&amp;Ms on #Halloween
1001	0	a	A #NeverTrump Republican just gave Trump a memorable new nickname
1002	1	a	Two Mid-Engine Corvette Prototypes Turn Up for Sale In New Jersey
1003	0	a	Netflix's most popular show of the past 8 months will surprise you
1004	0	a	You'll Never Believe What the New "Gilmore Girls" Reboot Is Called
1005	0	a	Facebook's Go-To Management Manual Says There's One Thing To Look For In Job Candidates Above All Else
1006	1	a	This job application question may become illegal
1007	1	a	Why dieters flock to Instagram
1008	0	a	New Galaxy Note 6 Leak Uncovers A Disturbing Missing Feature
1009	0	a	These universities are happy and they know it
1010	0	a	The No. 1 cause men care about the most
1011	2	a	How can you tell if someone has high emotional intelligence? Here are 5 signs:
1012	2	a	IMPORTANT: will you die alone?
1013	2	a	Eight reasons why kissing is so good for your health - from burning calories to slowing aging
1014	0	a	Woah! See HOW MUCH Arsenio Just Sued Sinead O'Connor For Over Prince ...
1015	1	a	It's not looking good for someone on "Grey's Anatomy"...
1016	2	a	Here's why happy couples post less about their relationships on social media
1017	0	a	Why @PassionPit canceled those concerts
1018	1	a	Man Who Pirated #TheRevenant Ordered to Pay $1.1 Million to 20th Century Fox
1019	0	a	You Won't Believe How Much Erin Andrews Won In Her Peeping Tom Lawsuit
1020	0	a	Transformers 5 finally has an official (but confusing) title
1021	0	a	Hillary Gets a One Word Reality Check from FBI Director After Calling Email Kerfuffle a 'Security Inquiry'
1022	0	a	They'll still find a way to call him a Nazi.
1023	0	a	#CyborgTrumpProblems aims to find Donald Trump's major malfunction
1024	0	a	Steam Summer Sale dates have leaked
1025	0	a	Are lions inherently mean?
1026	1	a	Teen births are plummeting - and the reason is incredibly simple
1027	1	a	Sisters Sing National Anthem. But When Girl On Right Opens Her Mouth? WOW.. Did NOT Expect That!!
1028	2	a	How to leave planet Earth
1029	0	a	The one mistake most new parents make before even leaving the hospital
1030	1	a	Ketchup Is a Garbage Condiment and You're a Moron if You Use it (Why Ketchup is Not Good for You)
1031	0	a	This Facebook message prank is a genius way to troll your friends
1032	0	a	Go here if you're looking for the best parks in the U.S.
1033	0	a	An Apple employee just leaked details about the iPhone 8
1034	2	a	The three biggest mistakes Hillary Clinton is making right now
1035	0	a	Shocking number of journalists were killed this year doing their jobs
1036	2	a	Why that shocking "Game of Thrones" death could happen in real life
1037	1	a	Christina Grimmie's Autopsy Report Reveals Her Official Cause of Death
1038	2	a	You've been eating subs wrong your whole life!
1039	1	a	How to beat online procrastination:
1040	0	a	You'll never guess who was behind this phone bill scam
1041	0	a	Now living by a busy road raises risk to pregnant women
1042	0	a	Here's how you can get a $10,000 gold Apple Watch for just $349:
1043	0	a	You Won't Believe Where the Next 'Battlefield' Game Is Going
1044	2	a	Movie director reveals why so many Hollywood marriages don't last
1045	1	a	This is the reason your jean pockets have tiny buttons, it's not the reason you would expect
1046	0	a	You Won't Believe Who ALMOST Played Captain America
1047	1	a	Kate Middleton's secret revealed -- How does William cope?
1048	1	a	Your Instagram feed will never be the same again
1049	2	a	Are you suffering from midlife malnutrition? How your face reveals the nutrients your body really needs
1050	2	a	17 extremely festive ways to get drunk
1051	2	a	This is what REALLY happens when you don't brush your teeth 
1052	0	a	Instagram Just Added This Highly Wanted Feature
1053	0	a	You'll Never Guess Who Walked In! > American Scientist
1054	0	a	Here's A Sign Your Ex Might Be A Psychopath
1055	1	a	Snoop Dogg Finally Reveals The Real Reason He Left Death Row Records
1056	0	a	One airline is now letting you watch your checked suitcase travel in real time
1057	1	a	An Angry Stranger Left This Note On Her Windshield. Her Response? You'll Be WOW'd!
1058	1	a	VIRAL PHOTO: Can you spot the missing legs?
1059	0	a	This California home has one very cool feature
1060	2	a	7 ways to #workout in #style this season
1061	0	a	An internet troll is helping to pick your next government
1062	0	a	Another university blocks students from passing out copies of the Constitution
1063	0	a	Stan Lee Reveals His Favorite Comic Book Movie
1064	0	a	Why Saudi Arabian Women Love Bumper Cars
1065	1	a	What you need to know if you plan on placing a wager, making a pick, or just want to sound smart during your party:
1066	1	a	Taylor Swift Kissed A Guy At A Party, But It Wasn't Tom Hiddleston
1067	0	a	Here's how many pot shops will open in Denver after weed is legal
1068	0	a	There's a pot dealer simulator on the App Store and it's No. 1.
1069	0	a	Enormous wetland restoration nears completion
1070	0	a	The one health factor we're still ignoring
1071	1	a	This congressman blames Pokemon Go players for worsening traffic; here's why
1072	1	a	You Won't Believe How Rachel Roy Handled a Run-in With Beyonce
1073	0	a	1 thing Google hasn't changed since their start 15 years ago
1074	0	a	Voters reject law that would extend LGBT protections
1075	0	a	This is the Actual Age When Getting Pregnant Becomes Much Harder
1076	0	a	College group sings "Royals" like you've never heard before
1077	0	a	Wow, Instagram has a lot of followers.
1078	2	a	18 creepy true crime theories that'll freak you the fuck out
1079	1	a	So you're kicked out of banking and have to change careers. This is what happens next
1080	0	a	This mysterious illness tied to marijuana use is on the rise in states with legal weed
1081	0	a	While Photographing An Abandoned Hospital, He Hears Strange Noises. Here's What He Found
1082	1	a	Your ISP is going to hate this device almost as much as you love it
1083	1	a	Why Donald Trump's speech at the Republican convention was historic
1084	1	a	Why it's a terrible idea to visit Hawaii while Obama is in town
1085	0	a	Is this what really broke Instagram?
1086	1	a	This Is What Men Pin On Pinterest
1087	1	a	For 70 Years, A Mug In Auschwitz Held A Secret Treasure
1088	1	a	Why @TyraBanks doesn't like the term "plus-size"
1089	1	a	"Single Ladies" fans get excited!
1090	1	a	This Wedding RSVP Card Is Going Viral For A Hilarious Menu Mistake
1091	1	a	Jennifer Garner Dating Her Accountant?
1092	0	a	Target announces new designer collaboration!
1093	2	a	These Four Things Could Reduce Your Risk Of Getting Cancer By 70 Percent
1094	1	a	Someone Figured Out Exactly Why Professor Snape Hates Neville Longbottom So Much
1095	2	a	How Trump won
1096	1	a	The Queen Had a Perfectly British Response to Brexit - Spoken like true royalty.
1097	0	a	The coming disaster that's going to kill 10 million people a year
1098	1	a	Why Does Eating Pineapple Make Your Mouth Sore?
1099	2	a	You May Have Seen These Trees In The Woods... But You'll NEVER Believe Who Put Them There.
1100	0	a	This May Be The Most Horrible Thing That Donald Trump Believes
1101	2	a	This girl didn't get into Oxford, so she did this to her rejection letter
1102	0	a	He Rescued This Bizarre Creature From a Sidewalk, But He Had No Idea What It Would Grow Into
1103	1	a	Career lessons you can draw from HBO's 'Big Little Lies'
1104	0	a	How US life expectancy ranks in the world
1105	1	a	Will Spending $200,000 On A Bed Really Help You Sleep?
1106	0	a	Meet the most underrated couple in Hollywood
