2188	0	a	Dog Breed Most Likely To Bite You Revealed, And It's Pretty Surprising
2189	0	a	If you're going to watch one movie this fall make sure this is it
2190	0	a	Bella Thorne shows off new 'Wild Kitty' tattoo in a VERY unusual place
2191	1	a	Women of the world united
2192	2	a	13 things more likely to kill you than a "refugee terrorist"
2193	2	a	Grown-up children reveal the one secret they would NEVER share with their parents
2194	1	a	You'll Never Guess Why This Picture Of A Penny Went Viral
2195	2	a	And the world's most honest cities are...
2196	0	a	Taste test: Which light beer blew away all the others?
2197	0	a	#CrossFit has a dirty little secret
2198	0	a	The category that 'Brooklyn' is in on Netflix will seriously annoy you
2199	0	a	Maroon 5 Cancelled Their North Carolina Shows, and You'll Never Guess Why
2200	1	a	What happens when these total strangers share eye contact for a whole minute?
2201	1	a	Amber Tamblyn sums up the messiness of breastfeeding in one photo
2202	0	a	You'll never believe who Britain's first lady inspires
2203	0	a	Here's what Microsoft cofounder Paul Allen actually found at the bottom of the ocean in the Philippines
2204	2	a	Rapper blasts "terrible journalism" &amp; "complete idiocy" of @WashingtonPost
2205	1	a	You asked, we answered: Is it safe for pregnant women to go swimming in a public pool?
2206	0	a	Bestselling crime author Patricia Cornwell opens up about her sexuality
2207	1	a	This tweet about Wendy's chicken nuggets could become the most retweeted tweet ever
2208	0	a	"Gossip Girl" star welcomes baby boy
2209	0	a	An anti-Trump site's domain name is apt AF
2210	1	a	Money expert Martin Lewis reveals how you can avoid a big bill for medical pills
2211	1	a	Are the Mythbusters Build Team getting their own Netflix show?
2212	0	a	Hillary Clinton's awful explanation for why she took Goldman Sachs' money
2213	0	a	Former President Noynoy Aquino finds new line of work
2214	0	a	Here's what Jennifer Aniston does when she hears the "Friends" theme
2215	2	a	Here's how to avoid one very common mistake
2216	1	a	The One Problem With the Hyperloop That Nobody's Talking About
2217	0	a	Millie Mackintosh gets slammed for Instagram pic and the reason is RIDICULOUS
2218	1	a	Local Police Are Warning If You Spot Purple Fence Posts To Get Away As Soon As You Can
2219	1	a	Cows In Haryana Get A 24-Hour Helpline And The Reason Will Baffle You!
2220	1	a	Here come retail sales...
2221	1	a	Why small dogs might really be more aggressive than big ones
2222	1	a	Here's Why Jet Black iPhone 7 Is Facing Worldwide Shortage
2223	1	a	Freddie Aguilar suggests solution to Torre de Manila 'photobombing'
2224	1	a	Mother gets cropped out of family photo, has furious response
2225	0	a	17 things Jesus Christ said about homosexuality
2226	0	a	A Dollar General Manager Reveals the Two Most Shoplifted Items at Dollar Stores
2227	0	a	This bank is closing the accounts of Iranian citizens
2228	1	a	J.J. Watt Tried To Snapchat With Fans, But Then This Happened...
2229	1	a	Their Mom Starts Singing. Then THIS Happens. I Can't Stop Smiling!
2230	1	a	The sad reason why women fake orgasms
2231	1	a	Only a French first lady could get away with this
2232	2	a	5 Things I Wish I Knew Before I Switched From iOS To Android
2233	0	a	Jennifer Lawrence Has Four Words for Donald Trump
2234	1	a	Is It Safe To Smoke Marijuana During Pregnancy? You'd Be Surprised Of The Answer
2235	2	a	UPDATE: Prof slammed to the ground and arrested university planning further review
2236	2	a	What happened to that AIDS drug that spiked 5000%?
2237	1	a	Does this footage show UFOs hovering above Tijuana, Mexico?
2238	2	a	The 25 most expensive ZIP codes in America
2239	0	a	What species would become dominant on earth if humans died out?
2240	2	a	9 Clever Substitutes for Everyday Kitchen Gadgets
2241	0	a	@kanyewest brings a special guest to @LateNightJimmy
2242	1	a	KFC Customers Shocked By Sign On Front Door (Photo)
2243	1	a	Will a six pack make you happy?
2244	1	a	Do you "like" the idea of a Facebook "dislike" button?
2245	2	a	After being dumped via text, this Cowboys fan got the best revenge
2246	0	a	@IAMJHUD's latest role was like having an orgasm
2247	0	a	"Friends" star heads back to TV
2248	0	a	Does it even matter that last year's iPhone 6s is so much faster than the new Galaxy Note 7?
2249	0	a	The Truth About Andy's Dad In "Toy Story" Will Make You Depressed
2250	1	a	NBC's Olympics 'nightmare' has all but come true
2251	0	a	Exchange Between An American Navy Ship And Canadian Authorities Is Too Absurd To Believe
2252	0	a	The One Psychological Principle You Need To Understand Politics In 2016
2253	1	a	Why you can't stop at just 1 spoonful of peanut butter
2254	1	a	Here's why President Obama isn't stopping his vacation to visit the Louisiana flooding
2255	1	a	Son found his parents' wedding video from 1953. That's when it hits him
2256	1	a	Katy Perry Releases 'Totally Nude' Video
2257	1	a	This Adorable Little Leaguer Stops Mid-Game To Give His Dad A Message
2258	1	a	Here's what happens if your Apple AirPods get lost or stolen
2259	1	a	Why 2016 is the best fall TV season in recent memory:
2260	1	a	Where Was Jon Snow's Direwolf Ghost During The Battle Of The Bastards?
2261	2	a	The top 10 foods to eat to beat bloating and get a flat stomach
2262	1	a	Has Sia responded to the lawsuit claiming her show was "impersonal" and "lacklustre"?
2263	1	a	What Happens When You Stick Your Head Into a Particle Accelerator
2264	0	a	Iran remade "Modern Family" frame by frame but one BIG thing is missing
2265	0	a	A Young Girl's Perfectly Preserved Body Was Unearthed. But What She's Holding Is a Mystery
2266	0	a	Calls for "daddy!" near a Connecticut school yield an odd discovery:
2267	0	a	Surprisingly the US city with the most gay couples is...
2268	0	a	This makeup challenge is putting unknown beauty brands on the map
2269	1	a	1 lucky person just won $400 Million in the Powerball lottery
2270	0	a	Harvard researchers discovered the one thing everyone needs for happier, healthier lives
2271	0	a	The next horrible boss in "Horrible Bosses" is...
2272	0	a	Daniel Craig Turned Down This Much Money to Play Bond Again
2273	2	a	Famous Actor Gets Standing Ovation For Speech On Surprising Topic
2274	1	a	iPhone 7 won't have a headphone jack, but Apple has a trick up its sleeve to keep you happy
2275	1	a	Bloodbath.
2276	0	a	The Surprising Thing Linked to High Blood Pressure
2277	0	a	Ghetto talent
2278	0	a	Find out what Prince George is called at preschool
2279	0	a	What the hell is wrong with Lionel Messi?
2280	1	a	THIS Is Why Mosquitoes Bite Some People More Than Others. Hint: It's Got Nothing To Do With Blood
2281	0	a	The Man Pulled The Shark Out Of The Water With His Bare Hands. What He Found In Its Jaws Shocked All Beachgoers.
2282	1	a	Everyone Was Waiting For Smriti Irani To React & Here's What She Has To Say
2283	1	a	What happened when 1 man found a stolen wallet at the end of his fishing line
2284	1	a	More bad news for Bieber
2285	1	a	Drink Beer? You Should Know This
2286	1	a	This could be really bad news for Apple
2287	2	a	10 things you need to know before the opening bell
2288	1	a	Steve Harvey's 7 Children Surprise Him On Live Television. But When His Stepson Says THIS, He's...
2289	1	a	Researchers Make a SHOCKING Claim That Humans Did NOT Evolve On Earth!
2290	0	a	Danny Brown's New Album Is Named After a Joy Division Song
2291	2	a	Why You Might Be Hearing That Donald Trump Donates Money To One Of The Worst Organizations On Earth
2292	0	a	He Places A Bar Of Soap In The Microwave, But You Won't Expect The Outcome
2293	0	a	You Won't Believe What Happens to Dogs on the Iditarod Trail
2294	0	a	Johnny Manziel reportedly went missing and showed up in a predictable place
2295	1	a	Why you shouldn't lecture your children about healthy eating
2296	1	a	Too big to fail?
2297	1	a	Best-dressed star @KerryWashington confesses major faux pas
2298	1	a	Have you been shadow partly cloudy-banned?
2299	1	a	The remarkable thing that happens to poor kids when you give their parents a little money
2300	2	a	15 Body Language Blunders Successful People Never Make
2301	1	a	The truth about Easyjet's first all-female crew
2302	1	a	How states are trying to lure those who didn't finish college into finishing their degrees
2303	1	a	Is fish poo the key to feeding the world's growing population?
2304	0	a	You won't believe what Beatles legend was actually denied entry to Tyga's Grammys party:
2305	1	a	New numbers reveal just how insanely popular Overwatch really is
2306	0	a	Meet the bad boy that kept T. Rex down
2307	0	a	How did China save the giant panda?
2308	1	a	What's the origin of the Easter Bunny?
2309	0	a	You'd Never Believe What This Woman Looks Like After Applying 100 Layers of Foundation
2310	2	a	22 things that will make you feel like an adult in February
2311	0	a	Here's What It Means When You Spot Someone Wearing A Safety Pin In The UK
2312	1	a	Study Proves that Men Really Do Prefer Curves, It's just not the curves you expect
2313	2	a	Meet the women fighting slut-shaming one sex story at a time
2314	0	a	Blizzard's warning to Overwatch players would make them think twice before using cheats
2315	0	a	Daniel Craig Turned Down This Much Money to Play Bond Again
2316	1	a	How Spy Tech Firms Let Governments See Everything on a Smartphone
2317	0	a	Smoking does something else to your body that you won't believe
2318	0	a	GUESS how much Rihanna's #MetGala cape weighed??
2319	0	a	Calling all stoners: Major newspaper seeks legal weed editor
2320	1	a	It may be the end of hedge funds as we know it
2321	0	a	Your Brain Will Age Better If You Do This
2322	0	a	Why NASA Is Building An $18 Billion Rocket To Nowhere
2323	0	a	Shocking moment a rapper was gunned down in a hail of bullets during a concert
2324	2	a	Why Marc Anthony is suing this online music company
2325	0	a	Who Stole a Rolex Off the Dying Tony Soprano? (James Gandolfini)
2326	1	a	One year later why don't we know anything about "Star Wars"?
2327	1	a	You won't believe why man kills girlfriend and her entire family
2328	1	a	An Expert Told Us What A Sex Dream About An Ex Saying 'I Love You' Means
2329	2	a	Researchers Debunk Medical Myths About Vitamin D
2330	0	a	'DWTS': And the Latest Celebrity to Leave Is...
2331	0	a	Remains Of An Enormous Sea Creature Are Baffling Beach-Goers In Wales
2332	0	a	Elton John: 3 Words That Could Save Your Life
2333	1	a	Lowe's Greeter with Big Smile Gets Bigger Surprise
2334	0	a	Watch these dads doing ballet with their daughters
2335	1	a	Chedz Alvarez stops a pineapple truck in Candoni. Find out why - Politiko Visayas Mindanao
2336	0	a	Jennifer Lawrence did the unimaginable at 'X-Men' world premiere
2337	2	a	There are 5 places in the US where you need to make over six figures to afford a home
2338	0	a	State refuses to let 74-year-old lesbian vet be buried next to her wife
2339	0	a	A Silent Killer That Every Girl Wears, Every Parent Needs To See This!
2340	2	a	Italian TV presenter gives viewers a real news 'flash'
2341	0	a	@KateUpton spotted holding hands with her rumored boyfriend
2342	0	a	The magic word that makes you seem extra persuasive:
2343	0	a	This Lake Holds Something Far More Dangerous Than Jaws
2344	2	a	Every non-iPhone thing Apple might unveil tomorrow
2345	1	a	This Cat Was Trying To Get The Attention Of Locals, But What Someone Finds With Her? Unbelievable
2346	0	a	I revamped my work wardrobe with almost no effort with this personal shopping service
2347	1	a	The evil thing a mother did to her 10-month-old daughter is beyond disturbing
2348	1	a	This 256 Year Old Man Broke His Silence Before His Death... And Revealed An Incredible Secret.
2349	2	a	What Is POTS and Why Haven't More People Heard of It?
2350	1	a	The Totally Counterintuitive Thing Science Says You Should Do to Your Resume
2351	0	a	Officer Notices The Teen Boy Behind Him Keeps Staring. Then The Server Reveals His Secret...
2352	0	a	You Won't BELIEVE What Strange Thing Was On Stand-By At Hillary's Rally!
2353	1	a	If You Own a Samsung Phone, Uninstall the Oculus Apps Right Now
2354	1	a	CNN: Coded message seen on Mars?
2355	1	a	Proof @KatyPerry loves John Mayer
2356	1	a	Why losing the Europa League final might actually be best for Liverpool
2357	0	a	State Rep. will stop smashing homeless peoples' shopping carts
2358	0	a	President Richard Nixon once landed his helicopter WHERE?
2359	2	a	This Is Where Women Are Seeking Peace In The World's Most Violent Country
2360	1	a	This week's "Sweden incident."
2361	0	a	Is it a boy or a girl for @KimKardashian and @KanyeWest? New report claims it's a...
2362	0	a	Two players meet in No Man's Sky, guess what happened next?
2363	2	a	Tom Hiddleston's Blunt Response To James Bond Rumors
2364	1	a	That's So Raven changed Disney Channel in ways no one could have predicted
2365	0	a	Man Sends Ex-Girlfriend Bizarre Breakup Gift Which She Blasts In Craigslist Ad
2366	2	a	"Twilight" star now playing a god
2367	2	a	How this Myanmar travel company went from $0 to $1,5 million in one year:
2368	0	a	.@taylorswift13's next '1989' single is...
2369	1	a	He Found A Hidden Cemetery... The Secrets It Contains Will Blow Your Mind.
2370	2	a	Hillary Clinton is considering a retired admiral for vice president. Or is she?
2371	1	a	Here's Alton Brown's trick for cooking pasta perfectly
2372	0	a	Homeless Vets Group In New York Asked Trump For Donation-You Won't Believe What He Sent!
2373	1	a	Why you should lower your standards, according to science
2374	0	a	Microsoft's new browser has a name only a mother could love
2375	0	a	@JTimberlake reveals which hit *NSYNC song was actually intended for Michael Jackson
2376	1	a	People Are Losing It Over This Photo Of Someone's Legs
2377	0	a	What if Apple Made iPhones in the US? Here's How Much You'd Pay
2378	0	a	Obama's 3-word message to those who boo Trump
2379	2	a	How to make the most of your workday
2380	1	a	iCarly's Nathan Kress Just 'Confirmed' The Most Bizarre Fan Theory
2381	0	a	The happiest country in the world is...
2382	2	a	Football star hospitalized after violent collision
2383	2	a	Searcher find missing firefighter's body
2384	1	a	'Drugs fix room is like my second home'
2385	0	a	The one and only thing Donald Trump fnds **underrated** according to his tweets
2386	0	a	This is the most beloved fast-food chain - in history
2387	0	a	Guess who is boycotting Target over its support of marriage equality
2388	1	a	The heartbreaking reason these sisters are planning a last-minute triple wedding
2389	2	a	I Made These Changes to How I Grocery Shop and Now I Save $200+/Month
2390	1	a	The only thing Ben &amp; Jerry ever fought about
2391	2	a	17 weird jobs you probably didn't know exist
2392	1	a	GREAT news for people on the northeast corridor:
2393	2	a	These are the 50 most influential gadgets of all time
2394	1	a	How a lab chemist went from "superwoman" to disgraced saboteur of more than 20,000 drug cases
2395	1	a	This is how you photograph a million dead plants without losing your mind
2396	2	a	These simple kitchen hacks will make your groceries last so much longer
2397	0	a	And the world's most beloved landmark is...
2398	1	a	This tweet perfectly sums up how terrifying 2017 is already
2399	0	a	Bryan Cranston returns to the small screen
2400	1	a	This veteran became the first combat amputee in the world to conquer this incredible feat
2401	0	a	Women who fake orgasms are also more likely to do this
2402	0	a	Here's how many undocumented immigrants there are estimated to be in the U.S.
2403	1	a	This Video of a Road Rage Brawl Will Crush Your Lingering Hope for Humanity
2404	1	a	Guy Breaks Up With His GF in Moving Car and You Won't Believe What She Did
2405	0	a	Popular radio talk show host returns to airwaves after controversial cancellation
2406	1	a	@HillaryClinton weighs in on Bowe Bergdahl swap:
2407	1	a	'We both avoided it...': Couple waits 9 years to open special wedding gift
2408	0	a	Incredibly Brilliant Trick To Discover if You Had PPI
2409	1	a	Brexit means Brexit ... but the big question is when?
2410	0	a	The surprising factor that may be affecting your biological clock
2411	1	a	After 73 Years, THIS Was How Explorers Found The Titanic. And It's Amazing.
2412	0	a	Sole Foods Street Farms opens North America's largest urban orchard
2413	0	a	Lingerie model: I realize my image contributes to girls' insecurities
2414	0	a	What's driving Silicon Valley to become 'radicalized'
2415	1	a	Microsoft won't back down from Windows 10 nagware 'trick'. Redmond assumes closing nagware dialog means 'yes', says that's by design
2416	2	a	18 life-saving facts that everyone should know
2417	1	a	Here's what makes #TRAPPIST1 special
2418	1	a	You won't believe whose cardigan Princess Charlotte wore at a royal garden party yesterday
2419	2	a	How 'Blair Witch' Director Adam Wingard Kept the Sequel Secret and Authentic
2420	0	a	The One Sex Problem 20-Something Couples Have That No One Talks About
2421	1	a	Huge black hole is set to do WHAT!?
2422	1	a	Prince's sister reveals the eerie thing that happened at his home after his death
2423	1	a	This will end well.
2424	1	a	How did this octopus escape his tank and flee to the ocean?
2425	0	a	This Man Had Buried His Deceased Wife, Then He Saw Her On TV
2426	0	a	Donald Trump ranted about all the DNC speakers on Twitter - except one
2427	0	a	Porcupine predicts the Super Bowl 48 winner
2428	1	a	Is Sparkling Water Bad for You?
2429	0	a	John Legend Would Consider Voting for Trump Under One Circumstance
2430	0	a	Obama Admin Just Outlawed Wildly Popular Product Found in Millions of Bathrooms
2431	0	a	The book we're talking about this summer
2432	1	a	He Pokes Nails Into A Lemon. The Result Is Insanely Cool.
2433	0	a	Why Betty White is changing her name
2434	0	a	What Young People Fear the Most
2435	0	a	Baltimore Ravens to release player amid animal cruelty allegations
2436	2	a	5 winning work strategies to borrow from millennials  via @NBCNewsBETTER
2437	1	a	@DollyParton addresses those tattoo rumors
2438	0	a	This makes us even more jealous of @KatyPerry
2439	0	a	College campus reeling after two freshmen deaths in one month
2440	0	a	What impressed me most about the iPhone 6 Plus is something nobody really talks about
2441	2	a	This is where it's still legal to hunt endangered turtles
2442	1	a	Why so many men are cooking
2443	0	a	His Child Starts Vomiting Uncontrollably. Then Dad Sees What The Worker Did To His Kid's Lunch...
2444	0	a	A LADY COMPLAINED TO THE PERSON WHO STOLE HER PARKING SPACE AND YOU WILL NEVER GUESS THE RESPONSE SHE GOT
2445	1	a	Cristiano Ronaldo poses naked for Vogue Spain
2446	0	a	This Grammy-winning album almost never happened
2447	1	a	TMI dude
2448	2	a	Drillers make surprising discovery in icy muck
2449	0	a	Kylie Jenner shares yet another racy photo this time with a cryptic message
2450	1	a	This is probably the most over the top gingerbread house ever
2451	0	a	These races will determine whether Republicans hold their Senate majority
2452	0	a	Ever Wonder Why There's A Hole Next To Your iPhone Camera? THIS Is What It Does
2453	2	a	What A Guy And His Girlfriend Did With This Dumpy Old Camper Is Brilliant. And I Want It.
2454	0	a	Students dig up an 800 year-old Native American clay pot. What they found inside is changing history
2455	0	a	Nail Biting Is A Sign Of This Personality Trait
2456	1	a	Poop study yields big surprise about Neanderthals
2457	1	a	You won't believe the insane way leftovers are being reused by China's restaurants
2458	2	a	These are the happiest and healthiest cities in America
2459	1	a	This One Trick Will Make Your Pasta So Much Better
2460	1	a	Watch What Happens If You Put A Diamond In A Hydraulic Press
2461	1	a	The reason dems are more popular presidents
2462	0	a	You'll never believe what this star of the cult film "Heavy Metal Parking Lot" does now
2463	1	a	Dietary Fail affecting 96% of Aussies
2464	2	a	16 things everyone should know before buying an engagement ring
2465	1	a	Revealed!! Why LEGO Toys Are So Expensive
2466	0	a	This Pink Snow Does Not Bode Well For Our Future
2467	0	a	Activision CEO sends out clear message when asked if Infinite Warfare changed after negative fan...
2468	0	a	Mom's blood goes cold when doctor breaks this news weeks after she delivered baby
2469	1	a	Is the Doomsday Clock moving closer to midnight?
2470	2	a	Creator of Pokemon Go shares terrible news for Pokevision and other Pokemon finding apps
2471	0	a	Doing this turns children into narcissists
2472	0	a	@BillGates and Warren Buffett love this book. You will too:
2473	1	a	This Is Why Misbah-Ul-Haq Celebrated His Century At Lord's With 10 Push-Ups
2474	0	a	Here's THE reason you should watch the Oscars
2475	0	a	Samuel Alito turned away at popular brunch spot
2476	0	a	Here's how much extra beer and pizza you consume during #MarchMadness
2477	1	a	Airdrie couple stops for coffee and you won't believe what happened next!
2478	0	a	This Company Wants To Grow Drones In Giant Vats Of Goo
2479	1	a	J.J. Abrams Admits To Major 'Star Wars' Opening Crawl Error
2480	1	a	A MAJOR benefit of sleep for developing brains
2481	0	a	This Father Dressed His Daughter For Day Care, And Missed A Few Important Things
2482	0	a	You won't believe which A-list actress @LenaDunham's boyfriend dated in HS
2483	0	a	You've never seen actress @rosariodawson like this before
2484	2	a	CBS host grills GOP senator on Obamacare
2485	1	a	Did they think we wouldn't notice?
2486	0	a	What @janemarielynch REALLY thinks of single life
2487	1	a	Adele admits to really gross habit that she just can't stop doing
2488	0	a	Chocolate maker tops creations with very bizarre ingredient
2489	0	a	Former GOP senator stars in new ad promoting marriage equality
2490	0	a	"Captain America: Civil War" Runtime Revealed; Could Be Marvel's Longest Movie Yet
2491	1	a	Why gymnastics teams sometimes pay judges $100 in cash
2492	0	a	Buffett's son says millennials can revolutionize this
2493	1	a	What the hell just happened in the BBC News studio?!
2494	1	a	One thing spacecraft have never achieved - until now
2495	0	a	British teen who hacked North Korea's version of Facebook reveals Kim Jong-un's 'easy to guess' password
2496	1	a	Did prehistoric people hold wakes for the dead?
2497	1	a	This is what Kim Kardashian wears for a $500k date with a billionaire
2498	1	a	Ever Felt Like You're Awake But Your Body Is Still Asleep? This Is Why It Happens
2499	2	a	11 iconic George Michael recordings that you absolutely must listen to
2500	0	a	Here's The Bridge That Is So Scary, People Have Panic Attacks Driving On It. You Have To Watch THIS
2501	1	a	Why @AppMeerkat is shifting focus from @twitter to @facebook
2502	1	a	New year's resolutions: How to lose the fat and get fit for free #HappyNewYear
2503	0	a	We Finally Know The True Size Of Donald Trump's Hands, And They're Kinda Small
2504	0	a	A video, a wheelchair and a suitcase: The mystery surrounding a Hong Kong tycoon's disappearance
2505	0	a	This is Officially The 'Oldest Animal On Earth'
2506	1	a	There's an important message about #marriage here
2507	2	a	These fruits and vegetables are the dirtiest
2508	1	a	Is this Americas most underrated national park?
2509	1	a	The cure for Ebola might come from...cows?
2510	2	a	Band gets massive @RedHourBen boost
2511	0	a	Major school district moves forward with controversial iPad program for students
2512	1	a	This little girl has an AWESOME idea
2513	1	a	You Should Rethink Marrying Your Boyfriend If This One Thing Applies To Him
2514	1	a	Is Seasons 1 &amp;amp; 2 of 'Mr Robot' on Netflix? - Whats On Netflix
2515	1	a	Ja Rule (@Ruleyork) responds to rumors that he's left his wife for his prison cellmate
2516	0	a	The country that drinks the most Coke per capita ponders a soda tax
2517	0	a	The unlikely assist that helped deliver Kevin Durant to the Warriors
2518	0	a	Gamer discovers secret method to catch region exclusive Pokemon from anywhere in the world
2519	2	a	Celebs You Didn't Know Passed Away: #17 is Shocking
2520	1	a	How to find out if someone has been stalking you on Facebook
2521	0	a	Can I get an Instagram shout-out from a celeb for my birthday?
2522	1	a	The Bizarre New Way To Eat Eggs That Has Everyone Going Crazy
2523	0	a	These guys deserve a standing ovation
2524	0	a	Donald Trump is making conservative newspapers do things they never thought they would do
2525	1	a	Here's The Real Reason Your Friend's 'Gluten-Free' Diet Might Be Making Them Feel Better
2526	0	a	The funny reason why Jets' Calvin Pryor had to turn down bachelor TV show
2527	0	a	Andrew Luck reveals nerdiest item he plans to buy when he receives new contract
2528	1	a	You'll never guess what motivates Trump and Clinton supporters most.
2529	0	a	This Stray Cat Couldn't Chose A Better Place To Give Birth!
2530	0	a	The Highest-Grossing Actress of All Time Has Been Revealed
2531	1	a	A headline so bizarre it could only happen on Breitbart 
2532	1	a	Uh oh, somebody at Honda is getting fired for this debate tweet
2533	1	a	Lenny Kravitz spotted kissing a first lady
2534	0	a	This is the best state for well-being (and no it's not Hawaii)
2535	1	a	Is Modern Education Making Childhood Years Not Carefree Anymore?
2536	0	a	Ex-pope calls famous scientist a "fiction writer"
2537	1	a	They Passed A Strange School Bus Late At Night... And What They Saw Is Utterly Chilling.
2538	0	a	Guess how much a single piece of Thomas Jefferson's hair is worth:
2539	1	a	Would Daniel Radcliffe Return For A Harry Potter Movie Sequel?
2540	1	a	Did 'Wheel Of Fortune' CHEAT a Contestant Out of $1 Million Opportunity Over a Technicality?
2541	2	a	When 2 of the 20th century's greatest icons finally met
2542	0	a	Their 6-year-old was killed with a neighbor's gun. A court just decided how much his life was worth.
2543	1	a	Arnold Schwarzenegger Reveals Embarrassing Secret After Filming Terrifying Elephant Attack
2544	0	a	Comedian is 'not sorry' for controversial Pearl Harbor joke on New Year's
2545	1	a	I used a coffee undereye mask for one week and the results weren't what I expected
2546	0	a	Chromecast 4K release date
